{"v":1,"bpm":128,"patterns":[[[72,4,100,85],[74,4,92,85],[76,2,104,80],[79,2,104,80],[76,4,96,85],[0,2,1,60],[74,2,88,80],[72,12,86,90]],[[72,4,102,85],[74,4,94,85],[76,4,106,85],[79,2,108,80],[81,2,110,80],[79,4,96,85],[0,2,1,60],[76,10,92,90]],[[79,2,118,75],[81,2,116,75],[83,2,120,75],[81,2,112,75],[79,4,114,80],[0,2,1,60],[77,2,110,75],[81,16,116,95]],[[72,4,80,85],[74,4,76,85],[76,4,84,85],[79,4,88,85],[0,2,1,60],[76,4,80,85],[72,10,72,90]],[[48,16,98,90],[57,16,94,90]],[[53,16,96,90],[55,16,94,90]],[[48,16,92,90],[48,16,90,90]],[[60,4,72,70],[64,4,68,70],[67,4,72,70],[64,4,68,70],[57,4,70,70],[60,4,66,70],[64,4,70,70],[60,4,66,70]],[[65,4,74,70],[69,4,70,70],[72,4,74,70],[69,4,70,70],[67,4,72,70],[71,4,68,70],[74,4,72,70],[71,4,68,70]],[[60,4,70,70],[64,4,66,70],[67,4,70,70],[64,4,66,70],[60,4,68,70],[64,4,64,70],[67,4,68,70],[64,4,64,70]],[[36,4,108,90],[42,4,58,80],[38,4,100,90],[42,4,58,80],[36,4,108,90],[42,4,58,80],[38,4,100,90],[42,4,58,80]]],"sequence":[[-1,4,7,10,75],[-1,4,7,10,75],[0,4,7,10,95],[0,4,7,10,95],[0,5,8,10,95],[0,5,8,10,95],[0,4,7,10,95],[1,4,7,10,100],[1,5,8,10,100],[1,5,8,10,100],[2,5,8,10,115],[2,5,8,10,115],[2,4,7,10,115],[2,4,7,10,110],[3,6,-1,10,80],[3,6,-1,-1,75]]}